title,year,authors,affiliations,journal,citations,keywords,affiliation_missing,source,doi,kc_relevant
Glaucoma and corneal transplant procedures,2012,Al-Mahmood A.M.; Al-Swailem S.A.; Edward D.P.,"Department of Ophthalmology, Ministry of Health, Manama 12, Bahrain; Division of Anterior Segment, King Khaled Eye Specialists Hospital, Riyadh 11462, Saudi Arabia; Wilmer Eye Institute, Johns Hopkins University, School of Medicine, Baltimore, MD 21287, United States",Journal of Ophthalmology,35,,False,Scopus,10.1155/2012/576394,True
Corneal ectasia following LASIK,2011,Tabbara KF.,,Saudi J Ophthalmol,0,,True,PubMed,10.1016/j.sjopt.2011.05.002,True
Corneal collagen crosslinking in the treatment of infectious keratitis,2011,Anwar H.M.; El-Danasoury A.M.; Hashem A.N.,"Magrabi Eye Hospital, Jeddah, Saudi Arabia",Clinical Ophthalmology,60,CCL; Riboflavin; UVA,False,Scopus,10.2147/opth.s24532,True
Late onset corneal ectasia after LASIK surgery,2011,"Said A, Hamade IH, Tabbara KF.",,Saudi J Ophthalmol,0,,True,PubMed,10.1016/j.sjopt.2011.05.003,True
Optical and topographic changes in keratoconus after implantation of ferrara intracorneal ring segments,2010,Hamdi I.M.,"Ophthalmology Department, Faculty of Medicine, Ain Shams University, Cairo, Egypt; Cornea and Refractive Surgery Department, Magrabi Eye and Ear Center, Jeddah, Saudi Arabia",Journal of Refractive Surgery,12,,False,Scopus,10.3928/1081597X-20100114-05,True
Corneal collagen cross-linking: Promises and problems,2010,Abdelghaffar W.; Hantera M.; Elsabagh H.,"Benha University, Benha, Egypt; Maghrabi Centre, Dammam, Saudi Arabia",British Journal of Ophthalmology,9,,False,Scopus,10.1136/bjo.2010.188342,True
Deep anterior lamellar Keratoplasty,2009,"Al-Kharashi SA, Al-Obailan MM, Almohaimeed M, Al-Torbak AA.",,Saudi J Ophthalmol,0,,True,PubMed,10.1016/j.sjopt.2009.10.004,True
"Comparison of central corneal thickness measurements by Pentacam, noncontact specular microscope, and ultrasound pachymetry in normal and post-LASIK eyes",2009,Al-Ageel S.; Al-Muammar A.M.,"Department of Ophthalmology, College of Medicine, King Saud University, Riyadh, Saudi Arabia",Saudi Journal of Ophthalmology,29,Central corneal thickness; Noncontact specular microscopy; Pentacam; Scheimpflug camera; Ultrasound pachymetry,False,Scopus,10.1016/j.sjopt.2009.10.002,True
Comparison between central corneal thickness measurements by oculus pentacam and ultrasonic pachymetry,2008,Al-Mezaine H.S.; Al-Amro S.A.; Kangave D.; Sadaawy A.; Wehaib T.A.; Al-Obeidan S.,"Department of Ophthalmology, College of Medicine, King Saud University, Riyadh 11321, PO Box 230387, Saudi Arabia; Diabetes Research Center, College of Medicine, King Saud University, Riyadh 11321, PO Box 230387, Saudi Arabia; The Eye Consultants Center, Riyadh, Saudi Arabia",International Ophthalmology,63,Agreement; Corneal thickness; Pachymetry; Pentacam; Ultrasound,False,Scopus,10.1007/s10792-007-9143-9,True
Ultrastructural analysis of collagen fibrils and proteoglycans in keratoconus,2008,Akhtar S.; Bron A.J.; Salvi S.M.; Hawksworth N.R.; Tuft S.J.; Meek K.M.,"School of Optometry and Vision Sciences, Cardiff University, Cardiff, United Kingdom; Department of Optometry and Vision Sciences, College of Applied Medical Sciences, King Saud University, Riyadh 11433, PO Box 1019, Saudi Arabia; Nuffield Laboratory of Ophthalmology, Oxford University, Oxford, United Kingdom; Department of Ophthalmology, Royal Glamorgan Hospital, Llantrisant, United Kingdom; Department of Clinical Ophthalmology, Moorfields Eye Hospital, London, United Kingdom",Acta Ophthalmologica,109,Collagen fibril; Keratoconus; Proteoglycans,False,Scopus,10.1111/j.1755-3768.2007.01142.x,True
Pharmacologic strategies in the prevention and treatment of corneal transplant rejection,2008,Tabbara K.F.,"The Eye Center and The Eye Foundation for Research in Ophthalmology, Riyadh 11534, P.O. Box 55307, Saudi Arabia",International Ophthalmology,43,Allograft; Autograft; Corneal; Corticosteroids; Graft rejection; Transplantation,False,Scopus,10.1007/s10792-007-9100-7,True
Deep lamellar keratoplasty with baring of descemet membrane: The big bubble technique,2007,Danasoury A.E.; Hashem A.,"Magrabi Eye and Ear Hospital, Jeddah, Saudi Arabia; Jeddah 21462, Jeddah, Khozam St, Makkah Rd, Saudi Arabia",Techniques in Ophthalmology,3,,False,Scopus,10.1097/ITO.0b013e31806edbd0,True
A new technique to mark the donor and host corneas in keratoplasty,2007,Kirat O.,"Anterior Segment Division, Department of Ophthalmology, King Khaled Eye Specialist Hospital, Riyadh, Saudi Arabia; Anterior Segment Division, King Khaled Eye Specialist Hospital, Riyadh, Saudi Arabia",Ophthalmic Surgery Lasers and Imaging,0,,False,Scopus,10.3928/15428877-20070501-15,True
Corneal Transplant Survival after Onset of Severe Endothelial Rejection,2007,Wagoner M.D.; Ba-Abbad R.; Sutphin J.E.; Zimmerman M.B.,"Department of Ophthalmology, King Khaled Eye Specialist Hospital, Riyadh, Saudi Arabia; Department of Ophthalmology and Visual Sciences, College of Medicine, University of Iowa, Iowa City, IA, United States; Department of Biostatistics, College of Medicine, University of Iowa, Iowa City, IA, United States",Ophthalmology,29,,False,Scopus,10.1016/j.ophtha.2006.12.012,True
Inverse relationship between age and severity and sequelae of acute corneal hydrops associated with keratoconus [8],2007,Al Suhaibani A.H.; Al-Rajhi A.A.; Al-Motowa S.; Wagoner M.D.; Al-Rajhi A.A.,"Anterior Segment Division, Department of Ophthalmology, King Khaled Eye Specialist Hospital, Riyadh, Saudi Arabia; Department of Research, King Khaled Eye Specialist Hospital, Riyadh, Saudi Arabia; King Khaled Eye Specialist Hospital, Riyadh 11462, PO Box 7191, Saudi Arabia",British Journal of Ophthalmology,70,,False,Scopus,10.1136/bjo.2005.085878,True
Epikeratoplasty,2006,Wagoner M.D.; Swailem S.A.; Rademaker W.J.; Rajhi A.A.,"King Khaled Eye Specialist Hospital, Riyadh, Saudi Arabia; Department of Ophthalmology, King Khaled Eye Specialist Hospital, Riyadh, Saudi Arabia; Department of Ophthalmology, King Khaled Eye Specialist Hospital, Riyadh, Saudi Arabia; King Khaled Eye Specialist Hospital, Riyadh, Saudi Arabia","Refractive Surgery, Second Edition",0,,False,Scopus,10.1016/B978-0-323-03599-6.50090-0,True
Woodhouse Sakati syndrome associated with bilateral keratoconus [3],2006,Al-Swailem S.A.; Al-Assiri A.A.; Al-Torbak A.A.,"Anterior Segment Division, Department of Ophthalmology, King Khaled Eye Specialist Hospital, Riyadh, Saudi Arabia; Anterior Segment Division, King Khaled Eye Specialist Hospital, Riyadh 11462, PO Box 7191, Saudi Arabia",British Journal of Ophthalmology,15,,False,Scopus,10.1136/bjo.2005.080101,True
Penetrating keratoplasty for macular corneal dystrophy,2005,Al-Swailem S.A.; Al-Rajhi A.A.; Wagoner M.D.,"Anterior Segment Division, Department of Ophthalmology, King Khaled Eye Specialist Hospital, Riyadh, Saudi Arabia; Department of Research, King Khaled Eye Specialist Hospital, Riyadh, Saudi Arabia; King Khaled Eye Specialist Hospital, Riyadh 11462, PO Box 7191, Saudi Arabia",Ophthalmology,36,,False,Scopus,10.1016/j.ophtha.2004.08.017,True
Histopathological and immunohistochemical studies of lenticules after epikeratoplasty for keratoconus,2005,Nakamura H.; Riley F.; Sakai H.; Rademaker W.; Yue B.Y.J.T.; Edward D.P.,"University of Illinois at Chicago, Department of Ophthalmology and Visual Sciences, Chicago, IL 60612, 1855 W Taylor Street, United States; Department of Ophthalmology and Visual Sciences, University of Illinois, Chicago College of Medicine, Chicago, IL, United States; King Khaled Eye Specialist Hospital, Riyadh, Saudi Arabia",British Journal of Ophthalmology,15,,False,Scopus,10.1136/bjo.2004.054684,True
Laser in situ keratomileusis for correction of high astigmatism after penetrating keratoplasty,2000,Rashad K.M.,"AL Mana General Hospital, Dammam 31451, P.O. Box 2366, Saudi Arabia",Journal of Refractive Surgery,43,,False,Scopus,10.3928/1081-597x-20001101-05,True
Terrien's marginal degeneration associated with posterior polymorphous dystrophy,1999,Wagoner M.D.; Teichmann K.D.,"Anterior Segment Division, Department of Ophthalmology, King Khaled Eye Specialist Hospital, Riyadh, Saudi Arabia; Massachusetts Eye and Ear Infirmary, Department of Ophthalmology, Harvard Medical School, Boston, MA, United States; King Khaled Eye Specialist Hospital, Riyadh 11462, P.O. Box 7191, Saudi Arabia",Cornea,11,Keratoconus; Marginal degeneration; Pellucid corneal; Posterior polymorphous dystrophy; Stromal-thinning disorders; Terrien's marginal degeneration,False,Scopus,10.1097/00003226-199909000-00017,True
Chemical injuries of the eye: Current concepts in pathophysiology and therapy,1997,Wagoner M.D.,"External Disease Division, King Khaled Eye Specialist Hospital, Riyadh, Saudi Arabia; Cornea Service, Massachusetts Eye and Ear Infirmary, Boston, MA, United States; Department of Ophthalmology, Harvard Medical School, Boston, MA, United States",Survey of Ophthalmology,499,acid; alkali; chemical injury; conjunctival transplantation; corneal epithelium; corneal limbus; corneal stroma; inflammation; limbal allograft; limbal autograft; mucous membrane transplantation; ocular surface; penetrating keratoplasty; tenoplasty,False,Scopus,10.1016/S0039-6257(96)00007-0,True
Penetrating keratoplasty in congenital hereditary endothelial dystrophy,1997,Al-Rajhi A.A.; Wagoner M.D.,"King Khaled Eye Specialist Hospital, Riyadh 11462, P.O. Box 7191, Saudi Arabia",Ophthalmology,48,,False,Scopus,10.1016/S0161-6420(97)30200-0,True
Management of perforations during epikeratoplasty for keratoconus,1996,Teichmann K.D.,"c/o Medical Library, King Khaled Eye Specialist Hospital, Riyadh 11462, P.O. Box 7191, Saudi Arabia",Journal of Cataract and Refractive Surgery,1,,False,Scopus,10.1016/S0886-3350(96)80061-7,True
Posterior keratoconus: Case report with scanning electron microscopy,1995,Al-Hazzaa S.A.F.; Specht C.S.; McLean I.W.; Harris Jr. D.J.,"Section of Ophthalmology, Department of Surgery, K. Faisal Specialist Hosp./Res. Ctr., Riyadh 11211, P. O. Box 3354, Saudi Arabia",Cornea,12,Cornea; Posterior keratoconus; Scanning electron microscopy,False,Scopus,10.1097/00003226-199505000-00014,True
Epikeratoplasty for Keratoglobus Associated with Blue Sclera,1991,Cameron J.A.; Cotter J.B.; Risco J.M.; Alvarez H.,"King Khaled Eye Specialist Hospital, Riyadh, Saudi Arabia",Ophthalmology,37,,False,Scopus,10.1016/S0161-6420(91)32271-1,True
